{
  "cycle_version": "DAE-AUTONOMOUS-EXPERT-CYCLE-1.0",
  "engine_version": "0.10.0-alpha.1",
  "generated_at": "2026-08-11T19:20:36Z",
  "run_id": "EXPERT-AUTO-LOCAL-SHA256-97E25B5E35796D5DF1E6E59F3CF562599061201341A5F18DC150EA27002DA279-9A27EAFDCC44",
  "profile": {
    "profile_id": "AUTO-LOCAL-SHA256-97E25B5E35796D5DF1E6E59F3CF562599061201341A5F18DC150EA27002DA279",
    "profile_sha256": "528eec27a0185211e9b866a33f8b877e8da161a48f0e2a7e9a7d60cb16e0c8a0",
    "title": "Автоматический экспертный профиль: LOCAL-SHA256-97E25B5E35796D5DF1E6E59F3CF562599061201341A5F18DC150EA27002DA279",
    "language": "und",
    "domain": "автоматическая критическая аналитика корпуса"
  },
  "source": {
    "source_id": "LOCAL-SHA256-97E25B5E35796D5DF1E6E59F3CF562599061201341A5F18DC150EA27002DA279",
    "artifact_sha256": "bac1378f02451273b4d0fd923cedde71d5dd050c30913def37ad4e67e3e0388d",
    "refinery_manifest_sha256": "e710fa3fd547b134614b3d3c0a099763d670ef56b6e5242c1b75ba7a4763ee91",
    "claim_ledger_entries": 7,
    "resolved_claim_level_citations": 0
  },
  "backend": {
    "kind": "DETERMINISTIC_PROFILE",
    "model": null,
    "external_content_transferred": false,
    "structured_output": false,
    "deterministic_gates_enforced": true
  },
  "prepasses": [
    "ETYMOLOGICAL_PASS"
  ],
  "etymology": {
    "protocol_version": "ETY-0.2",
    "run_id": "ETY-LOCAL_SHA256_97E25B5E35796D5DF1E6E59F3CF562599061201341A5F18DC150EA27002-B21A660A5672",
    "pass_sha256": "a0392891ad723165907d48c9aeb6c129cdf8f8cedb31344280e2d7e07a55567b",
    "cards": 1,
    "full_cards": 0,
    "coverage_complete": true,
    "unresolved_fields": 12,
    "semantic_promotion_without_independent_bridge": false
  },
  "passes": [
    "RECONSTRUCTOR",
    "CRITIC",
    "ADJUDICATOR",
    "SYNTHESIS"
  ],
  "thesis_results": [
    {
      "thesis_id": "AUTO_CORPUS_GENRE",
      "title": "Статус анализируемого корпуса",
      "statement": "Корпус должен оцениваться в соответствии с его структурно установленным жанром и происхождением слоёв, а не как автоматически единый первичный источник.",
      "status": "QUALIFIED",
      "confidence": 0.76,
      "finality": "FINAL_FOR_THIS_RUN",
      "scale": "DOCUMENT",
      "reconstruction": {
        "A": "Автоматическая сегментация различает источниковые, реконструктивные, проектные, критические и процедурные слои.",
        "P": "Жанровый статус корпуса ограничивает доказательную роль содержащихся в нём утверждений.",
        "B": "Система должна отделять структурную характеристику документа от содержательной истинности его тезисов."
      },
      "operative_relations": [
        "RT02",
        "RT15",
        "RT17"
      ],
      "evidence": {
        "topic_id": null,
        "topic_present": true,
        "evidence_count": 1,
        "distinct_group_count": 1,
        "case_matrix_present": true,
        "resolved_source_count": 0,
        "source_layer_selector_count": 0,
        "project_claim_selector_count": 1,
        "selectors": [
          "OX-P000007-0B194BE0E4"
        ],
        "selectors_truncated": false
      },
      "strongest_rival": {
        "rival_id": "AUTO_RIVAL_UNIFIED_SOURCE",
        "statement": "Все сегменты документа принадлежат одному источниковому голосу и могут суммироваться без различения происхождения.",
        "impact": "DEFEATED",
        "answer": "Структурные признаки многослойного составного контейнера непосредственно различают документ и единый первичный источник.",
        "discriminator": "Проверить маршруты слоёв, роль контейнера и разрешение ссылок на уровне отдельных утверждений."
      },
      "decisive_reasons": [
        "Роль контейнера: COMPOSITE_CONTAINER.",
        "Непустых маршрутизированных слоёв происхождения: 1.",
        "Разрешённых ссылок на уровне утверждений: 0."
      ],
      "analysis": "Структурная классификация задаёт допустимый предел последующих выводов. Роль контейнера: COMPOSITE_CONTAINER. Непустых маршрутизированных слоёв происхождения: 1. Разрешённых ссылок на уровне утверждений: 0.",
      "limitations": [
        "Маршрутизация происхождения остаётся консервативной и не заменяет источниковедческую проверку."
      ],
      "recommendation": "Сохранять происхождение каждого существенного утверждения во всех последующих проходах.",
      "deterministic_gate": "STRUCTURAL_GENRE_PARTIALLY_CONFIRMED",
      "model_trace_available": false
    }
  ],
  "global_analytics": {
    "analytic_status": "FINAL_FOR_THIS_RUN",
    "title": "Финальная автоматическая аналитика корпуса",
    "core_finding": "Корпус LOCAL-SHA256-97E25B5E35796D5DF1E6E59F3CF562599061201341A5F18DC150EA27002DA279 автоматически разделён на структурные слои, тематические гипотезы и проверяемые тезисы; окончательная сила каждого результата ограничена разрешением источников и типом доказательного бремени.",
    "supported_theses": [],
    "qualified_theses": [
      "AUTO_CORPUS_GENRE"
    ],
    "rejected_theses": [],
    "insufficient_theses": [],
    "decisive_reasons": [
      "Выявлено 0 тематических гипотез и 0 гетерогенных матриц.",
      "На уровне утверждений разрешено 0 внешних ссылок.",
      "Каждый тезис завершён одним из четырёх терминальных статусов без превращения нехватки данных в положительный результат."
    ],
    "rejected_conclusions": [
      "Лексическая совместность сама по себе доказывает истинность, авторство или универсальность тезиса."
    ],
    "next_actions": [
      "Разрешить происхождение ключевых селекторов на уровне утверждений.",
      "Проверить A/P/B, типы отношений и сильнейших соперников на независимой выборке."
    ],
    "final_verdict": "Корпус LOCAL-SHA256-97E25B5E35796D5DF1E6E59F3CF562599061201341A5F18DC150EA27002DA279 автоматически разделён на структурные слои, тематические гипотезы и проверяемые тезисы; окончательная сила каждого результата ограничена разрешением источников и типом доказательного бремени. В текущем прогоне: SUPPORTED — 0, QUALIFIED — 1, REJECTED — 0, INSUFFICIENT — 0."
  },
  "output_contract": {
    "final_analytics_emitted": true,
    "all_theses_terminal": true,
    "source_text_included": false,
    "model_generated_paraphrase_included": false,
    "uncertainty_disclosed": true,
    "mandatory_etymology_executed": true,
    "mandatory_etymological_significance": false
  },
  "claim_ceiling": "AUTONOMOUS_RUN_BOUND_EXPERT_ADJUDICATION_NOT_INFALLIBILITY_OR_EXTERNAL_VALIDATION"
}
