{
  "cycle_version": "DAE-AUTONOMOUS-EXPERT-CYCLE-1.0",
  "engine_version": "0.10.0-alpha.1",
  "generated_at": "2026-08-11T19:21:02Z",
  "run_id": "EXPERT-AUTO-LOCAL-SHA256-EE4ADE50D68A2909A9784677A69017798A30747AECA5F0A4C3DF543DAEC2674F-108B1A41678C",
  "profile": {
    "profile_id": "AUTO-LOCAL-SHA256-EE4ADE50D68A2909A9784677A69017798A30747AECA5F0A4C3DF543DAEC2674F",
    "profile_sha256": "e0fbbd9ee3709d7e5c01155aa07003c83fa2d4bd5b01df1e44eafe5d1e72c437",
    "title": "Автоматический экспертный профиль: LOCAL-SHA256-EE4ADE50D68A2909A9784677A69017798A30747AECA5F0A4C3DF543DAEC2674F",
    "language": "und",
    "domain": "автоматическая критическая аналитика корпуса"
  },
  "source": {
    "source_id": "LOCAL-SHA256-EE4ADE50D68A2909A9784677A69017798A30747AECA5F0A4C3DF543DAEC2674F",
    "artifact_sha256": "239fefbdb840823de7177eb92682788ae53802f42dacaa16c3404a6531679eb9",
    "refinery_manifest_sha256": "9f46f6df42bfc04262ebb9a902fc23436b7c8f500c98c3d9e7e59a3719295c3f",
    "claim_ledger_entries": 4,
    "resolved_claim_level_citations": 0
  },
  "backend": {
    "kind": "DETERMINISTIC_PROFILE",
    "model": null,
    "external_content_transferred": false,
    "structured_output": false,
    "deterministic_gates_enforced": true
  },
  "prepasses": [
    "ETYMOLOGICAL_PASS"
  ],
  "etymology": {
    "protocol_version": "ETY-0.2",
    "run_id": "ETY-LOCAL_SHA256_EE4ADE50D68A2909A9784677A69017798A30747AECA5F0A4C3DF543DAEC-6E8E6EF8DAA1",
    "pass_sha256": "92eae35043e50dea3a4c712f8ee6f07eacd9b6a3abd4ec2e70f08e0ad9d2c958",
    "cards": 1,
    "full_cards": 0,
    "coverage_complete": true,
    "unresolved_fields": 12,
    "semantic_promotion_without_independent_bridge": false
  },
  "passes": [
    "RECONSTRUCTOR",
    "CRITIC",
    "ADJUDICATOR",
    "SYNTHESIS"
  ],
  "thesis_results": [
    {
      "thesis_id": "AUTO_CORPUS_GENRE",
      "title": "Статус анализируемого корпуса",
      "statement": "Корпус должен оцениваться в соответствии с его структурно установленным жанром и происхождением слоёв, а не как автоматически единый первичный источник.",
      "status": "INSUFFICIENT",
      "confidence": 0.9,
      "finality": "FINAL_FOR_THIS_RUN",
      "scale": "DOCUMENT",
      "reconstruction": {
        "A": "Автоматическая сегментация различает источниковые, реконструктивные, проектные, критические и процедурные слои.",
        "P": "Жанровый статус корпуса ограничивает доказательную роль содержащихся в нём утверждений.",
        "B": "Система должна отделять структурную характеристику документа от содержательной истинности его тезисов."
      },
      "operative_relations": [
        "RT02",
        "RT15",
        "RT17"
      ],
      "evidence": {
        "topic_id": null,
        "topic_present": true,
        "evidence_count": 0,
        "distinct_group_count": 0,
        "case_matrix_present": true,
        "resolved_source_count": 0,
        "source_layer_selector_count": 0,
        "project_claim_selector_count": 0,
        "selectors": [],
        "selectors_truncated": false
      },
      "strongest_rival": {
        "rival_id": "AUTO_RIVAL_UNIFIED_SOURCE",
        "statement": "Все сегменты документа принадлежат одному источниковому голосу и могут суммироваться без различения происхождения.",
        "impact": "UNRESOLVED",
        "answer": "Доступных разрешённых свидетельств недостаточно, чтобы устранить соперника или предпочесть ему исходный тезис.",
        "discriminator": "Проверить маршруты слоёв, роль контейнера и разрешение ссылок на уровне отдельных утверждений."
      },
      "decisive_reasons": [
        "Не выполнен минимальный доказательный порог: селекторов 0 < 1; различимых групп 0 < 1."
      ],
      "analysis": "Структурная классификация задаёт допустимый предел последующих выводов. Не выполнен минимальный доказательный порог: селекторов 0 < 1; различимых групп 0 < 1.",
      "limitations": [
        "Маршрутизация происхождения остаётся консервативной и не заменяет источниковедческую проверку."
      ],
      "recommendation": "Сохранять происхождение каждого существенного утверждения во всех последующих проходах.",
      "deterministic_gate": "EVIDENCE_THRESHOLD_NOT_MET",
      "model_trace_available": false
    }
  ],
  "global_analytics": {
    "analytic_status": "FINAL_FOR_THIS_RUN",
    "title": "Финальная автоматическая аналитика корпуса",
    "core_finding": "Корпус LOCAL-SHA256-EE4ADE50D68A2909A9784677A69017798A30747AECA5F0A4C3DF543DAEC2674F автоматически разделён на структурные слои, тематические гипотезы и проверяемые тезисы; окончательная сила каждого результата ограничена разрешением источников и типом доказательного бремени.",
    "supported_theses": [],
    "qualified_theses": [],
    "rejected_theses": [],
    "insufficient_theses": [
      "AUTO_CORPUS_GENRE"
    ],
    "decisive_reasons": [
      "Выявлено 0 тематических гипотез и 0 гетерогенных матриц.",
      "На уровне утверждений разрешено 0 внешних ссылок.",
      "Каждый тезис завершён одним из четырёх терминальных статусов без превращения нехватки данных в положительный результат."
    ],
    "rejected_conclusions": [
      "Лексическая совместность сама по себе доказывает истинность, авторство или универсальность тезиса."
    ],
    "next_actions": [
      "Разрешить происхождение ключевых селекторов на уровне утверждений.",
      "Проверить A/P/B, типы отношений и сильнейших соперников на независимой выборке."
    ],
    "final_verdict": "Корпус LOCAL-SHA256-EE4ADE50D68A2909A9784677A69017798A30747AECA5F0A4C3DF543DAEC2674F автоматически разделён на структурные слои, тематические гипотезы и проверяемые тезисы; окончательная сила каждого результата ограничена разрешением источников и типом доказательного бремени. В текущем прогоне: SUPPORTED — 0, QUALIFIED — 0, REJECTED — 0, INSUFFICIENT — 1."
  },
  "output_contract": {
    "final_analytics_emitted": true,
    "all_theses_terminal": true,
    "source_text_included": false,
    "model_generated_paraphrase_included": false,
    "uncertainty_disclosed": true,
    "mandatory_etymology_executed": true,
    "mandatory_etymological_significance": false
  },
  "claim_ceiling": "AUTONOMOUS_RUN_BOUND_EXPERT_ADJUDICATION_NOT_INFALLIBILITY_OR_EXTERNAL_VALIDATION"
}
